INSERT INTO DEPT (DNO, DNAME, LOCATION, DEPT_BUDGET)
VALUES ('D1', 'Marketing', 'CHN', 500000);
1 row created

INSERT INTO DEPT (DNO, DNAME, LOCATION, DEPT_BUDGET)
VALUES ('D2', 'Research', 'MNG', 300000);
1 row created

INSERT INTO DEPT (DNO, DNAME, LOCATION, DEPT_BUDGET)
VALUES ('D3', 'IT', 'BNG', 400000);
1 row created


INSERT INTO DEPT (DNO, DNAME, LOCATION, DEPT_BUDGET)
VALUES ('D4', 'HR', 'BGG', 200000);
*
ERROR at line 1:
ORA-02290: check constraint (SYSTEM.VALID_LOC_CONS) violated

INSERT INTO DEPT (DNO, DNAME, LOCATION, DEPT_BUDGET)
VALUES ('D4', 'HR', 'BNG', 200000);
1 row created.

INSERT INTO DEPT (DNO, DNAME, LOCATION, DEPT_BUDGET)
VALUES ('D5', 'Accounts', 'BNG', 500000);
1 row created.

INSERT INTO DEPT (DNO, DNAME, LOCATION, DEPT_BUDGET)
VALUES (NULL, 'Corporate', 'HYD', 700000);
1 row created.

************EXTRA*****************
INSERT INTO DEPT (DNO, DNAME, LOCATION, DEPT_BUDGET)
VALUES ('D6', 'Sales', 'MUB', 600000);
1 row created.

INSERT INTO DEPT (DNO, DNAME, LOCATION, DEPT_BUDGET)
VALUES ('D7', 'Finance', 'HYD', 350000);
1 row created.

*************************************
INSERT INTO PROJ (DNO, PRJ_NO, PRJ_NAME, PRJ_CREDIT, PRJ_FUND, STRT_DATE, END_DATE)
VALUES ('D1', 'P1', 'Project 1', 4, 400000, TO_DATE('2024-08-01', 'YYYY-MM-DD'), TO_DATE('2024-12-01', 'YYYY-MM-DD'));
1 row created.

INSERT INTO PROJ (DNO, PRJ_NO, PRJ_NAME, PRJ_CREDIT, PRJ_FUND, STRT_DATE, END_DATE)
VALUES ('D2', 'P1', 'Project 1', 2, 200000, TO_DATE('2024-08-15', 'YYYY-MM-DD'), TO_DATE('2024-11-15', 'YYYY-MM-DD'));
1 row created.

INSERT INTO PROJ (DNO, PRJ_NO, PRJ_NAME, PRJ_CREDIT, PRJ_FUND, STRT_DATE, END_DATE)
VALUES ('D3', 'P2', 'Project 2', 3, 300000, TO_DATE('2024-09-01', 'YYYY-MM-DD'), TO_DATE('2024-12-01', 'YYYY-MM-DD'));
1 row created.

INSERT INTO PROJ (DNO, PRJ_NO, PRJ_NAME, PRJ_CREDIT, PRJ_FUND, STRT_DATE, END_DATE)
VALUES ('D1', 'P3', 'Project 3', 5, 500000, TO_DATE('2024-07-01', 'YYYY-MM-DD'), TO_DATE('2024-10-01', 'YYYY-MM-DD'));
1 row created.

INSERT INTO PROJ (DNO, PRJ_NO, PRJ_NAME, PRJ_CREDIT, PRJ_FUND, STRT_DATE, END_DATE)
VALUES ('D4', 'P2', 'Project 2', 7, 700000, TO_DATE('2024-08-10', 'YYYY-MM-DD'), TO_DATE('2024-12-10', 'YYYY-MM-DD'));
1 row created.

**************EXTRA*****************
INSERT INTO PROJ (DNO, PRJ_NO, PRJ_NAME, PRJ_CREDIT, PRJ_FUND, STRT_DATE, END_DATE)
VALUES ('D5', 'P1', 'Project 4', 6, 600000, TO_DATE('2024-09-01', 'YYYY-MM-DD'), TO_DATE('2024-12-15', 'YYYY-MM-DD'));
1 row created.

INSERT INTO PROJ (DNO, PRJ_NO, PRJ_NAME, PRJ_CREDIT, PRJ_FUND, STRT_DATE, END_DATE)
VALUES ('D5', 'P1', 'Project 4', 6, 600000, TO_DATE('2024-09-01', 'YYYY-MM-DD'), TO_DATE('2024-12-15', 'YYYY-MM-DD'));
1 row created.

INSERT INTO PROJ (DNO, PRJ_NO, PRJ_NAME, PRJ_CREDIT, PRJ_FUND, STRT_DATE, END_DATE)
VALUES ('D2', 'P3', 'Project 5', 8, 800000, TO_DATE('2024-10-01', 'YYYY-MM-DD'), TO_DATE('2025-02-01', 'YYYY-MM-DD'));
1 row created.

*************************************
INSERT INTO TASK (TASK_ID, TASK_NAME, PRJ_ID, DNO, S_DATE, E_DATE, STATUS) 
VALUES (1, 'Design Phase', 'P1', 'D1', TO_DATE('2024-08-01', 'YYYY-MM-DD'), TO_DATE('2024-09-01', 'YYYY-MM-DD'), 'COMPLETED');
1 row created.

INSERT INTO TASK (TASK_ID, TASK_NAME, PRJ_ID, DNO, S_DATE, E_DATE, STATUS) 
VALUES (2, 'Development Phase', 'P1', 'D2', TO_DATE('2024-09-02', 'YYYY-MM-DD'), TO_DATE('2024-10-15', 'YYYY-MM-DD'), 'IN PROGRESS');
1 row created.

INSERT INTO TASK (TASK_ID, TASK_NAME, PRJ_ID, DNO, S_DATE, E_DATE, STATUS) 
VALUES (1, 'Design Phase', 'P2', 'D3', TO_DATE('2024-08-10', 'YYYY-MM-DD'), TO_DATE('2024-09-10', 'YYYY-MM-DD'), 'COMPLETED');
1 row created.

INSERT INTO TASK (TASK_ID, TASK_NAME, PRJ_ID, DNO, S_DATE, E_DATE, STATUS) 
VALUES (2, 'Development Phase', 'P3', 'D1', TO_DATE('2024-09-15', 'YYYY-MM-DD'), TO_DATE('2024-11-01', 'YYYY-MM-DD'), 'NOT STARTED');
1 row created.

INSERT INTO TASK (TASK_ID, TASK_NAME, PRJ_ID, DNO, S_DATE, E_DATE, STATUS) 
VALUES (3, 'Testing Phase', 'P3', 'D1', TO_DATE('2024-11-02', 'YYYY-MM-DD'), TO_DATE('2024-12-01', 'YYYY-MM-DD'), 'NOT STARTED');
1 row created.

**************EXTRA*****************
INSERT INTO TASK (TASK_ID, TASK_NAME, PRJ_ID, DNO, S_DATE, E_DATE, STATUS) 
VALUES (4, 'Deployment Phase', 'P1', 'D2', TO_DATE('2024-11-02', 'YYYY-MM-DD'), TO_DATE('2024-12-01', 'YYYY-MM-DD'), 'NOT STARTED');
1 row created.

INSERT INTO TASK (TASK_ID, TASK_NAME, PRJ_ID, DNO, S_DATE, E_DATE, STATUS) 
VALUES (2, 'Development Phase', 'P2', 'D3', TO_DATE('2024-09-11', 'YYYY-MM-DD'), TO_DATE('2024-11-01', 'YYYY-MM-DD'), 'IN PROGRESS');
1 row created.



*************************************
INSERT INTO Emp VALUES (101, 'Ravi', 'MGR', NULL, TO_DATE('10-10-1985', 'DD-MM-YYYY'), 32000, 10000, 'D1', TO_DATE('02-10-2001', 'DD-MM-YYYY'), 'P1');
1 row created.
>100 REFER MANUAL

INSERT INTO Emp VALUES (102, 'Raviraj', 'CLRK', NULL, TO_DATE('10-12-1980', 'DD-MM-YYYY'), 24000, 11000, 'D1', TO_DATE('12-11-2000', 'DD-MM-YYYY'), 'P3');
1 row created.

INSERT INTO Emp VALUES (111, 'Raghu', 'GM', NULL, TO_DATE('10-12-1974', 'DD-MM-YYYY'), 45000, 15000, NULL, TO_DATE('03-12-1985', 'DD-MM-YYYY'), NULL);
1 row created.

INSERT INTO Emp VALUES (150, 'Ramu', 'CEO', NULL, TO_DATE('10-12-1970', 'DD-MM-YYYY'), 60000, 30000, NULL, TO_DATE('03-12-1990', 'DD-MM-YYYY'), NULL);
1 row created.

INSERT INTO Emp VALUES (103, 'Raju', 'CLRK', NULL, TO_DATE('10-12-1980', 'DD-MM-YYYY'), 21000, 7000, 'D1', TO_DATE('02-10-2001', 'DD-MM-YYYY'), 'P1');
1 row created.
~A.CLRK REFER MANUAL

INSERT INTO Emp VALUES (120, 'Raju', 'CLRK', NULL, TO_DATE('02-10-1980', 'DD-MM-YYYY'), 21000, 7000, 'D1', TO_DATE('02-10-2002', 'DD-MM-YYYY'), 'P3');
1 row created.

INSERT INTO Emp VALUES (125, 'Manu', 'A.MGR', NULL, TO_DATE('10-12-1980', 'DD-MM-YYYY'), 23000, 9000, 'D4', TO_DATE('02-10-2002', 'DD-MM-YYYY'), 'P2');
1 row created.

INSERT INTO Emp VALUES (104, 'Manoj', 'CLRK', NULL, TO_DATE('02-10-1980', 'DD-MM-YYYY'), 23000, 9000, 'D2', TO_DATE('02-10-2005', 'DD-MM-YYYY'), 'P1');
1 row created.

INSERT INTO Emp VALUES (106, 'Manohar', 'MGR', NULL, TO_DATE('02-10-1986', 'DD-MM-YYYY'), 33000, 12000, 'D2', TO_DATE('02-10-2005', 'DD-MM-YYYY'), 'P1');
1 row created.
~DATE ERROR REFER MANUAL

INSERT INTO Emp VALUES (123, 'Mahesh', 'CLRK', NULL, TO_DATE('10-12-1974', 'DD-MM-YYYY'), 25000, 10000, 'D3', TO_DATE('02-10-2002', 'DD-MM-YYYY'), 'P2');
1 row created.

INSERT INTO Emp VALUES (108, 'Mayank', 'CLRK', NULL, TO_DATE('10-12-1970', 'DD-MM-YYYY'), 25000, 10000, 'D3', TO_DATE('02-10-1985', 'DD-MM-YYYY'), 'P2');
1 row created.

INSERT INTO Emp VALUES (130, 'Malhan', 'CLRK', NULL, TO_DATE('10-12-1980', 'DD-MM-YYYY'), 25000, 10000, 'D1', TO_DATE('02-10-2001', 'DD-MM-YYYY'), 'P3');
1 row created.
103 ERROR CHECK MANUAL

INSERT INTO Emp VALUES (131, 'Maanya', 'CLRK', NULL, TO_DATE('10-12-1980', 'DD-MM-YYYY'), 21000, 5000, 'D5', TO_DATE('10-12-2000', 'DD-MM-YYYY'), 'P1');
1 row created.

INSERT INTO EMP (EMPNO, ENAME, JOB, MGRID, DATE_BIRTH, SAL, COMM, DEPTNO, DATE_JOIN, PRJ_ID)
VALUES (132, 'John', 'CLRK', NULL, TO_DATE('15-08-1990', 'DD-MM-YYYY'), 26000, 2000, 'D3', TO_DATE('05-05-2015', 'DD-MM-YYYY'), 'P2');
1 row created.

INSERT INTO EMP (EMPNO, ENAME, JOB, MGRID, DATE_BIRTH, SAL, COMM, DEPTNO, DATE_JOIN, PRJ_ID)
VALUES (133, 'Sara', 'MGR', NULL, TO_DATE('20-11-1985', 'DD-MM-YYYY'), 35000, 5000, 'D5', TO_DATE('12-07-2010', 'DD-MM-YYYY'), 'P1');
1 row created.

UPDATE EMP SET MGRID=111 WHERE EMPNO=101;

1 row updated.

UPDATE EMP SET MGRID=106 WHERE EMPNO=102;

1 row updated.

UPDATE EMP SET MGRID=150 WHERE EMPNO=111;

1 row updated.

UPDATE EMP SET MGRID=111 WHERE EMPNO=103;

1 row updated.

UPDATE EMP SET MGRID=111 WHERE EMPNO=120;

1 row updated.

UPDATE EMP SET MGRID=150 WHERE EMPNO=125;

1 row updated.

UPDATE EMP SET MGRID=125 WHERE EMPNO=104;

1 row updated.

UPDATE EMP SET MGRID=111 WHERE EMPNO=106;

1 row updated.

UPDATE EMP SET MGRID=150 WHERE EMPNO=123;

1 row updated.

UPDATE EMP SET MGRID=106 WHERE EMPNO=108;

1 row updated.

UPDATE EMP SET MGRID=111 WHERE EMPNO=130;

1 row updated.

UPDATE EMP SET MGRID=106 WHERE EMPNO=131;

1 row updated.

UPDATE EMP SET MGRID = 111 WHERE EMPNO = 132;

1 row updated.

UPDATE EMP SET MGRID = 133 WHERE EMPNO = 133;

1 row updated.





3.5 Run COMMIT command. Delete the employee records working on project P3 and confirm the result. Type ROLLBACK to restore the records back if records are deleted.
COMMIT;

SQL> DELETE FROM EMP WHERE PRJ_ID = 'P3';

3 rows deleted.

SQL> SELECT * FROM EMP WHERE PRJ_ID = 'P3';

no rows selected

SQL> ROLLBACK;

Rollback complete.

SQL> SELECT * FROM EMP WHERE PRJ_ID = 'P3';

     EMPNO ENAME      JOB            MGRID DATE_BIRT        SAL       COMM DEP
---------- ---------- --------- ---------- --------- ---------- ---------- ---
DATE_JOIN PRJ_I
--------- -----
       102 Raviraj    CLRK             106 10-DEC-80      24000      11000 D1
12-NOV-00 P3

       120 Raju       CLRK             111 02-OCT-80      21000       7000 D1
02-OCT-02 P3

       130 Malhan     CLRK             111 10-DEC-80      25000      10000 D1
02-OCT-01 P3



3.6 Run COMMIT command. Delete Accounts department from the DEPT table and confirm the result with reason. Type ROLLBACK to restore the records back if records are deleted
COMMIT;
DELETE FROM DEPT WHERE DNAME = 'Accounts';
DELETE operation failed because there are child records in other tables that reference the department you are trying to delete.

3.7
Run COMMIT command. Delete records of employees with Empno 125 and working
in project P2. Type ROLLBACK to restore the records back, if records are deleted.
COMMIT;
DELETE FROM EMP 
WHERE EMPNO = 125 
AND PRJ_ID = 'P2';

DELETE operation failed because there are child records in other tables that reference the department you are trying to delete.


3.8 Run COMMIT command .Delete all the tasks under Project P2. If deleted,type ROLLBACK to restore the records.
SQL> COMMIT;

Commit complete.

SQL> DELETE FROM TASK
  2  WHERE PRJ_ID = 'P2';

2 rows deleted.

SQL> SELECT * FROM TASK
  2  WHERE PRJ_ID = 'P2';

no rows selected

SQL> ROLLBACK;

Rollback complete.

SQL> SELECT * FROM TASK
  2  WHERE PRJ_ID = 'P2';

   TASK_ID
----------
TASK_NAME
--------------------------------------------------------------------------------
PRJ_I DNO S_DATE    E_DATE    STATUS
----- --- --------- --------- --------------------------------------------------
         1
Design Phase
P2    D3  10-AUG-24 10-SEP-24 COMPLETED

         2
Development Phase
P2    D3  11-SEP-24 01-NOV-24 IN PROGRESS





3.9 Update the DNO of first record in PROJ to D5
-- Update the DNO of the record with the smallest PRJ_NO

SELECT * 
FROM PROJ
ORDER BY PRJ_NO
FETCH FIRST ROW ONLY;


UPDATE PROJ
SET DNO = 'D5'
WHERE PRJ_NO = (
    SELECT MIN(PRJ_NO) 
    FROM PROJ
);

ERROR at line 1:
ORA-00001: unique constraint (SYSTEM.PK_PROJ) violated



3.10 Update the Job of employee with Empno 123 to MGR, salary to 35000 and his manager as 111.

UPDATE EMP
SET JOB = 'MGR',
    SAL = 35000,
    MGRID = 111
WHERE EMPNO = 123;

1 row updated.

SELECT * FROM EMP
WHERE EMPNO = 123;



3.11 Update the EMP table to set the default commission of all employees to Rs.10000/-who are working as managers.

UPDATE EMP
SET COMM = 10000
WHERE JOB = 'MGR' OR JOB = 'A.MGR' OR JOB = 'GM';
5 rows updated.

SELECT EMPNO, ENAME, JOB, COMM
FROM EMP
WHERE JOB = 'MGR' OR JOB = 'A.MGR' OR JOB = 'GM';


